{
  "schema_version": 1,
  "run_id": "run_douyin_001",
  "package_id": "pkg_artifact_001",
  "account_id": "acct_douyin_pilot_001",
  "platform": "douyin",
  "state": "waiting_for_human",
  "state_version": 3,
  "attempt": 1,
  "current_step": "await_human_publish",
  "idempotency_key": "pkg_artifact_001:acct_douyin_pilot_001:1",
  "human_confirmation": {"required": true, "confirmed": false, "confirmed_at": null, "actor_ref": null},
  "created_at": "2026-07-19T00:00:00Z",
  "updated_at": "2026-07-19T00:00:01Z"
}
